{
  "地区": "未明确（可能为某城市）",
  "适用范围": {
    "水": "市属排供水企业服务区域（区属区域价格可能不同）",
    "电": "未明确",
    "气": "城市管网供应区域"
  },
  "公告日期": "未明确",
  "生效日期": "未明确",
  "阶梯计量周期": "户年",
  "价格详情": {
    "水": {
      "价格构成说明": "综合水价 = 自来水价格 + 污水处理费",
      "阶梯价格": [
        {
          "用户类型": "一户一表居民用户",
          "阶梯": "第一阶梯",
          "用量范围": {
            "下限": 0,
            "上限": 220,
            "单位": "立方米"
          },
          "自来水价格（元/立方米）": 2.25,
          "污水处理费（元/立方米）": 2.00,
          "综合水价（元/立方米）": 4.05
        },
        {
          "用户类型": "一户一表居民用户",
          "阶梯": "第二阶梯",
          "用量范围": {
            "下限": 221,
            "上限": 300,
            "单位": "立方米"
          },
          "自来水价格（元/立方米）": 4.00,
          "污水处理费（元/立方米）": 2.00,
          "综合水价（元/立方米）": 5.80
        },
        {
          "用户类型": "一户一表居民用户",
          "阶梯": "第三阶梯",
          "用量范围": {
            "下限": 301,
            "单位": "立方米",
            "说明": "以上"
          },
          "自来水价格（元/立方米）": 6.99,
          "污水处理费（元/立方米）": 2.00,
          "综合水价（元/立方米）": 8.79
        }
      ],
      "非居民价格": [
        {
          "用户类型": "执行居民价格的非居民用户",
          "自来水价格（元/立方米）": 2.52,
          "污水处理费（元/立方米）": 2.00,
          "综合水价（元/立方米）": 4.32
        }
      ],
      "附注": [
        "应缴纳污水处理费总额 = 用水量 × 污水处理费(2.00元/立方米) × 0.9",
        "区属供排水企业服务区域内居民用户自来水价格和污水处理费，请咨询当地价格部门或水务部门。"
      ]
    },
    "电": {
      "计价模式说明": "居民用户可选择未分时电价或分时（峰谷）电价计费",
      "居民阶梯价格": [
        {
          "用户类型": "一户一表居民用户",
          "档位": "第一档",
          "用量范围": {
            "下限": 0,
            "上限": 3120,
            "单位": "度"
          },
          "未分时电价（元/度）": 0.617,
          "分时电价（元/度）": {
            "峰时": 0.617,
            "谷时": 0.307
          }
        },
        {
          "用户类型": "一户一表居民用户",
          "档位": "第二档",
          "用量范围": {
            "下限": 3121,
            "上限": 4800,
            "单位": "度"
          },
          "未分时电价（元/度）": 0.667,
          "分时电价（元/度）": {
            "峰时": 0.677,
            "谷时": 0.337
          }
        },
        {
          "用户类型": "一户一表居民用户",
          "档位": "第三档",
          "用量范围": {
            "下限": 4801,
            "单位": "度",
            "说明": "以上"
          },
          "未分时电价（元/度）": 0.917,
          "分时电价（元/度）": {
            "峰时": 0.977,
            "谷时": 0.487
          }
        }
      ],
      "非居民价格": [
        {
          "用户类型": "执行居民价格的非居民用户",
          "电压等级": "不满1千伏",
          "价格（元/度）": 0.641
        },
        {
          "用户类型": "执行居民价格的非居民用户",
          "电压等级": "10千伏",
          "价格（元/度）": 0.636
        }
      ]
    },
    "气": {
      "居民阶梯价格": [
        {
          "用户类型": "居民用户",
          "档位": "第一档",
          "用量范围": {
            "下限": 0,
            "上限": 310,
            "单位": "立方米"
          },
          "价格（元/立方米）": 3.00
        },
        {
          "用户类型": "居民用户",
          "档位": "第二档",
          "用量范围": {
            "下限": 311,
            "上限": 520,
            "单位": "立方米"
          },
          "价格（元/立方米）": 3.30
        },
        {
          "用户类型": "居民用户",
          "档位": "第三档",
          "用量范围": {
            "下限": 521,
            "单位": "立方米",
            "说明": "以上"
          },
          "价格（元/立方米）": 4.20
        }
      ],
      "非居民价格": [
        {
          "用户类型": "执行居民价格的非居民用户",
          "价格（元/立方米）": 3.05
        }
      ]
    }
  },
  "附注": [
    "用户可向当地供电营业厅或通过线上渠道申请峰谷分时电价。",
    "水、电、气阶梯价格均按‘户年’用量为周期执行。"
  ]
}
